A+ Nursery,A+ Nursery produces a huge variety of landscaping plants with a specialty in edible landscaping.,
Spinning Spider Creamery,"Spinning Spider Creamery is a fully licensed artisan dairy offering a variety of fresh and aged goat and cow milk cheeses. They hand-craft select fresh, bloomy rind, and raw milk aged cheeses with state of the art equipment and solar technology. Their cheeses as well as their goats have won recognition regionally and nationally. They are a family business dedicated to the lifestyle of raising healthy children and goats on their family farm. Spinningspidercreamery.com",https://www.facebook.com/pages/Spinning-Spider-Creamery/135990076422331?fref=ts
Split Creek Farm,"Split Creek Farm specializes in award-winning farmstead goat cheeses, goat milk fudge and goat milk yogurt. Production has grown from the original four-gallon vat batches in 1988 to the current 150-gallon vat operation. Their certified goat herd produces all the milk used for its cheese and fudge and competes nationally in the show ring and for milk production records. Herd health and the ultimate quality of the dairy products are the primary concern of the owners. Splitcreek.com",https://www.facebook.com/pages/Split-Creek-Farm/163620308361?fref=ts
Sproingers Dryer Balls,"Sproingers are 100% wool dryer balls. A natural fabric softener, wool absorbs static cling and fluffs clothing. Sproingers Dryer Balls are infused with dried lavender, along with lavender essential oil. You can refresh your Sproinger by adding your favorite essential oil or scent.",
Spurgeon Farms,Spurgeon Farms was established in Taylors in May 2003 by Dodi & Alton Spurgeon. The farm produces an abundance of chemical-free fruits and vegetables year-round. Vegetables range from the traditional to the unusual. Dodi's kitchen is the center of attention during the growing season.,https://www.facebook.com/pages/Spurgeon-farms/402556246503239?fref=ts
Super 'Nola Natural,"Super 'Nola Natural was created through an earnest desire to jumpstart your day with a breakfast that was high in fiber and protein, contained no refined sugar and was chock full of whole foods, real foods, natural foods, super foods! All products are made in Greenville, South Carolina, using as many locally sourced ingredients as possible. Supernolanatural.com",https://www.facebook.com/Super-Nola-Natural-1375880776037791/?fref=ts
Swamp Rabbit Cafe & Grocery,"The Swamp Rabbit Cafe and Grocery uses high-quality ingredients including King Arthur Artisan flours, local dairy products and seasonal/organic produce which come from within 150 miles of Greenville when possible. Swamprabbitcafe.com",https://www.facebook.com/pages/Swamp-Rabbit-Cafe-and-Grocery/177010222350810?fref=ts
T & L Enterprises,"T&L Enterprises features many different varieties of orchids, pitcher plants, bromeliads, calla lilies, gardenias and various other houseplants. With plants started during the winter months in Florida and then transplanted up in Landrum, South Carolina, T&L Enterprises brings a bit of tropical flare to the Upstate.",
The Happy Berry,"The Happy Berry Inc. is located on the eastern shore of Lake Keowee in Pickens County, South Carolina. It is a pick-your-own small fruit farm with blackberries, blueberries, muscadines, grapes and figs available in-season. The season is June through September in most years. Pre-picked berries are also available on the farm. Thehappyberry.com",https://www.facebook.com/pages/The-Happy-Berry/106112095866?fref=ts
Three Graces Dairy,"Three Graces Dairy produces farmstead cheeses made with milk from the their herds of cows, goats and sheep. All of their ""farm pets"" are spoiled rotten on a diet of healthful grain, supplements and free range pastures managed without the use of herbicides or pesticides. Their farm & dairy is a small-scale multi-tasking environment employing local people who share their knowledge of the community and their wisdom in all things land and animal. 3gracesdairy.com",https://www.facebook.com/pages/Three-Graces-Dairy/1538054786416509?sk=info&tab=overview
Thrive Upstate,"The Generous Garden Project brings together community agencies to expand inclusion and employment opportunities for people with significant disabilities, who learn to cultivate, grow, and harvest vegetables, plants, flowers, and trees to be used or sold throughout the County of Greenville and Upstate South Carolina.",https://www.facebook.com/ThriveUpstate
Traditional Fermentations,Traditional Fermentations focuses on natural lactic acid fermentations in foods to aid in improving immune function and digestive health.,https://www.facebook.com/pages/Traditional-Fermentations/1577465049165860?sk=timeline
Tyger River Smart Farm,Tyger River Smart Farm uses a state-of-the-art hydroponic greenhouse to supply plants with ideal growing conditions. A constant stream of nutrient-infused water is supplied to the roots of a plant without the use of soil thus their plants never touch a single grain of dirt. Produce is harvested with the roots still attached and will stay just-picked-fresh for several weeks in the refrigerator. Tygerriversmartfarm.com,https://www.facebook.com/TygerRiverSmartFarm/timeline
Watsonia Farms,"For the past four generations, the Watson family has brought the best in fruit and produce to South Carolina. Using cutting-edge agricultural practices, they provide some of the best fruit and produce anywhere, at a price you can afford. Watsonia has food safety certifications through the USDA and Primus, and organic certification from the Clemson University Department of Plant Industry and USDA National Organic Program. Watsoniafarms.com",
Tyger Valley Farm,"Tyger Valley Farm was established in 2010 in Woodruff SC after moving the farm from upstate NY. Tyger Valley Farm grows shrubs, bulbs, perennials, annual flowers from seed, herbs and even collect weeds for the most beautiful and unique mixed bouquets. Because of their extensive collection of plants every week the selections change. Tyger Valley Farm services the TD Saturday Market with farm fresh flowers from the first week in May until the first freeze in the fall.",https://www.facebook.com/pages/Tyger-Valley-Farm/212555612132597?sk=timeline
Upstate Greens,"Upstate Greens is an urban farm that produces various varieties of leafy greens and micro greens in a 40′ refrigerated shipping container. Launched in 2015, Upstate Greens uses all natural growing methods, organic soils and feed, and non treated seed. Upstategreens.com",http://www.farmvetco.org/homegrown-by-heroes/
Watsonia Farms,"For the past four generations, the Watson family has brought the best in fruit and produce to South Carolina. Using cutting-edge agricultural practices, they provide some of the best fruit and produce anywhere, at a price you can afford. Watsonia has food safety certifications through the USDA and Primus, and organic certification from the Clemson University Department of Plant Industry and USDA National Organic Program. Watsoniafarms.com",
West End Coffee Roasters,"West End Coffee Company is a series sponsor and will be at the market every Saturday selling hot coffee and whole bean and ground coffee. Some of their most popular varieties include Jamaican Me Crazy, Smoky Mountain Blend and Biltmore Blend, along with many others. Westendcoffee.com",https://www.facebook.com/WestEndCoffeeCo?fref=ts
Whitewater Products,"Whitewater Products is a family-based nursery out of Salem, South Carolina. They have been a loyal TD Saturday Market vendor since 2011.",https://www.facebook.com/Whitewaterproducts
Wild Salmon Co.,"Wild Salmon Co. is a family run outfit committed to providing customers with wild caught Alaska salmon. Each summer they head to Alaska to participate in the largest Sockeye salmon fishery in the world. After their salmon are caught, they are placed into an icy bath that quickly cools them & then delivered to a processing facility to preserve the ""just-caught"" freshness. The salmon is then transported by barge to Seattle & trucked across the country to the Carolinas. Thewildsalmonco.com",https://www.facebook.com/pages/Heidis-Wild-Salmon/270656416343588?fref=ts
